name,content,url,type,summary
南茂,封測大廠南茂 () 今 (21) 日宣布，董事會通過 100% 轉投資子公司 ChipMOS TECHNOLOGIES (BVI) LTD. 出售持有宏茂微電子 (上海) 的 45.0242% 全數股權給中國當地合夥企業，粗估交易金額約 42.9 億元，處分損失約 4180 萬元，實際損益數字依實際交易日為準。南茂此次將宏茂微電子出售的對象是蘇州元禾璞華智芯股權投資合夥企業等 11 家中國當地的合夥企業，總交易金額為 9.793 億元，折合約 42.9 億元。南茂補充，此次出售分兩期交割股權，其中第二期的價款將於第一期價款支付 6 個月後支付，預估處分損失為 4180 萬元，實際損益數字將依實際交易日之財報金額及匯率而有差異，以實際入帳數為準。董事長鄭世杰表示，南茂科技長期深耕於半導體利基封測領域，並專注於高成長的終端應用市場，為順應產業的發展趨勢與考量公司的整體營運佈局策略、同時進一步強化公司的財務與競爭實力，經董事會決議出售所持有宏茂全數股權。鄭世杰強調，將出售股權所得價金作為未來中長期營運發展之用，如車用、5G、智慧家庭以及 AI 等高成長領域，未來除持續擴充高階產能、擴大高成長產品的市佔率外，也以核心技術為主軸開發，滿足客戶產品需求的相關技術，維持公司的競爭優勢。,https://news.cnyes.com/news/id/5417113,p,封測大廠南茂今日宣布，董事會通過100%轉投資子公司ChipMOSTECHNOLOGIESLTD.出售持有宏茂微電子的45.0242%全數股權給中國當地合夥企業，粗估交易金額約42.9億元，處分損失約4180萬元，實際損益數字依實際交易日為準。
緯創,緯創 () 資通今 (21) 日召開董事會，會中通過在 10 億元的額度內，捐贈國立陽明交通大學台南分部同行樓預定地新建工程。緯創資通表示，整體計畫預計在簽約後 2 年內完成興建。 陽明交大計畫提供台南分部校地，預計基地面積為 8100 平方公尺，約 2450 坪，用於興建不動產。緯創資通捐建的建物將包括地上 5 層樓、屋頂及地下 1 層樓，總樓地板面積約為 5712 坪。 緯創表示，在完成興建不動產，且將建物所有權捐贈給陽明交大後，承租捐建館舍面積不超過總樓地板面積比例之 70%。期望能為南台灣高科技發展注入新的動力，並促進產學合作。 陽明交大為第一個進駐台南沙崙綠能科學城的單位，台南沙崙為中央政府 5+2 產業綠能科技發展中心。2018 年起已陸續展開相關硬體建設，目前進入密集階段，包括中研院南部分院，以及大台南會展中心等單位。 陽明交大已在園區內設立「光電學院」以及「智慧科學暨綠能學院」，積極培育人才，並成為綠能科學城發展的重要合作夥伴，希望藉此帶動台南的產學研究聚落效應。,https://news.cnyes.com/news/id/5417032,p,緯創資通今日召開董事會，會中通過在10億元的額度內，捐贈國立陽明交通大學台南分部同行樓預定地新建工程。緯創資通表示，整體計畫預計在簽約後2年內完成興建。 陽明交大計畫提供台南分部校地，預計基地面積為8100平方公尺，約2450坪，用於興建不動產。緯創資通捐建的建物將包括地上5層樓、屋頂及地下1層樓，總樓地板面積約為5712坪。
緯穎,緯穎 () 宣布推出兩款新一代邊緣運算伺服器產品，緯穎指出兩款新產品都搭載英特爾 () 第 5 代 Xeon 可擴充處理器。緯穎執行副總呂舜星表示，兩款新品擁有更高的運算能力及更快速的傳輸能力，滿足 AI 邊緣運算需求。 兩款伺服器分別為 ES200G2 及 ES100G2，緯穎觀察，在人工智慧的時代，各種由大型語言模型驅動 (LLM) 的應用，為了滿足 AI 推論與模型微調的需求，對於資料處理、運算能力以及低延遲的要求日益提升。 緯穎最新邊緣運算伺服器整合英特爾第 5 代 Xeon 可擴充處理器，可以充分發揮其優勢，包括內建的 AI 加速、 Intel Advanced Matrix Extensions(Intel AMX)、更快的 DDR5 記憶體及 PCIe Gen5 等技術。緯穎指出，兩款伺服器相較前一代，在同樣功耗下提供更強大的性能，可以提高運算效率，並降低整體擁有成本，同時也為網路及邊緣運算代來新的可能性。 緯穎說明，ES200G2 為短機箱 2U 單 CPU 邊緣運算伺服器，整合加速運算、儲存及網路橫向擴展等功能。支援兩張寬度 GPU 卡和 4 個 NVMe SSD，適合人工智慧的推論與訓練，更可以做到 3D 圖形、渲染及視訊分析、多存去邊緣運算等。緯穎補充，由於 ES200G2 為邊緣端的 AI 工作負載提供全面性的運算效能，可應用於 CDN、智慧城市和智慧工廠等。 ES100G2 則是短機箱 1U 單 CPU 邊緣運算伺服器，緯穎指出，ES100G2 符合 NEBS Level 3 的標準。透過 4 個 PCle Gen5 擴充插槽，以及 silicon-based 安全性的設計，可以滿足 vRAN 和 far edge 軟體定義網路 (SDN) 等網路工作負載需求。另外，ES100G2 利用英特爾內建的運算加速器及遙測功能 (telemetry)，讓網路通訊服務供應商更容易管理並更有效率的部署。 呂舜星說，透過最新整合最新技術，並與英特爾合作，突破邊緣伺服器的效能限制，配備更高的運算能力、更快的記憶體，並達到高速資料傳輸，進一步抓住邊緣運算商機。,https://news.cnyes.com/news/id/5416676,p,緯穎宣布推出兩款新一代邊緣運算伺服器產品，緯穎指出兩款新產品都搭載英特爾第5代Xeon可擴充處理器。支援兩張寬度GPU卡和4個NVMeSSD，適合人工智慧的推論與訓練，更可以做到3D圖形、渲染及視訊分析、多存去邊緣運算等。 ES100G2則是短機箱1U單CPU邊緣運算伺服器，緯穎指出，ES100G2符合NEBSLevel3的標準。
東陽,汽車零組件大廠東陽 () 今 (21) 日召開董事會，會中全體董事一致推舉吳永茂董事為新任董事長，原董事長吳永豐為榮譽董事長，東陽指出，此為兄弟傳承永續的經營信念。東陽三兄弟中，吳永豐為大哥，已年逾 80 歲，吳永茂排行老二，小大哥 9 歲，而老三吳永祥為集團總裁，也是公司總經理，三兄弟堅持家族公平持股並共同管理。東陽指出，吳永茂擅長企業經營管理，早年帶領東陽，建立規章制度與人才培育、開發外銷市場，繼而規劃國外設廠，全球資源整合與布局，至此東陽站穩全球 AM 最大供應商的龍頭地位。時至今日，吳永茂秉持傳承與永續信念，榮膺董事長後，將繼續擘劃集團發展方向，帶領東陽再次攀登高峰。而吳永豐擔任董事長期間，帶領東陽股票上市，與兄弟齊心協力拓展海外生產據點，擴大營業規模，使東陽從在地企業成長為國際化企業，卸任後不吝傳承經驗，將持續擔任榮譽董事長。東陽為因應北美市場對汽車 AM 件的需求，日前公告過斥資 5.95 億元購入台南市科工區逾 4879 坪土地，東陽表示，未來將整合事業資源，進行全球運籌管理，充分發揮資源運用的最大效益，並串聯汽車塑膠、鈑金內外裝部品、風扇馬達等產品線，持續提高 OEM、AM 兩大市場的規模與競爭能力，再創東陽營運新榮景。,https://news.cnyes.com/news/id/5416655,p,東陽三兄弟中，吳永豐為大哥，已年逾80歲，吳永茂排行老二，小大哥9歲，而老三吳永祥為集團總裁，也是公司總經理，三兄弟堅持家族公平持股並共同管理。時至今日，吳永茂秉持傳承與永續信念，榮膺董事長後，將繼續擘劃集團發展方向，帶領東陽再次攀登高峰。
雲品,"連鎖飯店和宴會業者雲品 () 今 (21) 日宣布受理委託經營新案，與興悅地產開發簽署合約，將進駐南投埔里福興溫泉區，雲品總經理丁原偉表示，未來更規劃將頂級餐廳與旅館聯盟，目標挑選台灣高端旅宿約 20 家，串連各個業主，共同投入精緻高端餐旅市場。對於此次南投埔里福興溫泉區委託案，雲品說明，規劃將在 1300 坪的溫泉區中興建 6 棟奢華溫泉別墅和附屬戶外宴會、室內餐飲空間，並設有小型有機生態農場結合私廚餐廳，可有效縮短碳足跡，並確保食材的新鮮與可追溯性，具體落實永續的理念。丁原偉進一步指出，雲品透過君品 Collection 承攬委託經營案，從第一階段的宴會事業管理 (Banquet)，到第二階段的餐飲與宴會管理 (Food, Beverage & Banquet)，許多業者對精緻服務、利潤共享、永續循環有共同理念，不斷洽談提案，目前君品 Collection 發展到第三階段高端旅宿服務 (High-end Accommodation) 已漸成熟，並陸續取得精緻、小型量體的餐旅物業委託經營。因此，丁原偉目標，後續推動頂級餐廳與旅館聯盟，目標挑選台灣高端旅宿約 20 家，串連各個業主共同投入精緻高端餐旅市場。興悅地產總經理李鴻岳表示，由營建業起家，近年已陸續進行多項住宅、廠辦和商辦開發計畫，此次與雲品合作，希望在南投埔里約 1300 坪溫泉基地中，提供頂級溫泉旅宿體驗新選擇。福興溫泉的泉質為 42.9 度的溫泉水，屬於碳酸氫鹽泉，被俗稱為美人湯，除了泡湯，雲品規劃生態農場，在餐飲規格上則可辦理 100-150 人的頂級私人派對，是繼烏來紅河谷「蘇卡利 ‧ 漫活」後的第二處奢華溫泉別墅旅宿委託經營案。南投縣政府為廬山遷建開發打造的「福興溫泉區」，是全台第一個以溫泉產業造鎮的開發案，設立有全台唯一溫泉為主題的親子共融公園，並鄰近中台禪寺、能高親水公園與埔里酒廠等知名觀光景點，更串連日月潭風景區。目前雲品國際受理的委託經營案共有五大類型，分別為星級酒店委託經營管理、宴會暨餐飲事業管理、頂級旅宿經營管理、永續園區營運管理、豪宅銷售延伸服務管理，合計達 11 處，包括雲品酒店杭州、翰品酒店新莊宴會事業、新北淡水嘉廬、桃園皇家薇庭、台東紅葉谷綠能溫泉園區、台中蘭克斯特、新北烏來「蘇卡利 ‧ 漫活」、台南宜樂安平、台北茹曦酒店餐飲暨宴會事業、台中水湳「圓觀」、台南安平「亞果薈」。",https://news.cnyes.com/news/id/5416361,p,連鎖飯店和宴會業者雲品今日宣布受理委託經營新案，與興悅地產開發簽署合約，將進駐南投埔里福興溫泉區，雲品總經理丁原偉表示，未來更規劃將頂級餐廳與旅館聯盟，目標挑選台灣高端旅宿約20家，串連各個業主，共同投入精緻高端餐旅市場。因此，丁原偉目標，後續推動頂級餐廳與旅館聯盟，目標挑選台灣高端旅宿約20家，串連各個業主共同投入精緻高端餐旅市場。
晶技,台灣頻率元件廠晶技 () 在第三季的旺季需求過後，第四季 11 月營收 10.36 億元，仍站穩 10 億元大關之上，而目前估算 12 月訂單也維持在 10 億元水準，加計前 11 月營收 99.4 億元，全年營收營收將達 109 億元，也優於原預期，也使晶技股價在類股中展現抗跌力道。法人預估，晶技 2023 年第四季營收將較第三季下滑，季減幅估約 2-3%，且將守住單季營收 30 億元的水準，也將較去年同期成長。晶技營收今年自 8 月以來即站穩 10 億元大關，10 月及 11 月營收都勝過去年同期表現，12 月營收以 10 億元計算，也呈現年增 3% 的成長，而目前看來以 9 月的 11.12 億元爲今年的營收高峰。晶技 2023 年前三季營收 78.1 億元，毛利率 34.72%，年減 3.51 個百分點，前三季稅後純益 13.06 億元，年減 44.74%，每股純益爲 4.22 元。依晶技自結獲利數來看，晶技 2023 年前 11 月營收 99.4 億元，年減 18.52%，自結稅前盈餘 19.8 億元，年減 40%，每股稅前盈餘爲 6.39 元。目前晶技在車用產品營收占比約 15-16%，並已取得全球車用頻率元件市場 10% 市占率。寧波車用專用產品生產將在明 (2024) 年第二季正式投產，晶技對明年汽車應用營收比重訂下 20% 目標。,https://news.cnyes.com/news/id/5416288,p,法人預估，晶技2023年第四季營收將較第三季下滑，季減幅估約2-3%，且將守住單季營收30億元的水準，也將較去年同期成長。晶技2023年前三季營收78.1億元，毛利率34.72%，年減3.51個百分點，前三季稅後純益13.06億元，年減44.74%，每股純益爲4.22元。
