name,content,url,type,summary
國泰金,碳交所國際碳權交易平台今 (22) 日上線，開啟碳權交易新里程碑，國泰金 () 與旗下人壽、銀行、證券、產險、投信五家子公司共襄盛舉成為首購國際碳權金融業之一。為支持碳權交易發展，國泰世華銀行宣布打造「碳權交易價金信託服務」並整合收付清算機制，擔任清算行角色，共同完善國內碳權交易機制。碳權為抵銷碳排的方式之一，但除營運碳排外，為發揮金融永續影響力，國泰金表示，目前以致力於賦能客戶減碳行動，帶動產業低碳轉型為優先，未來將持續發揮金融核心職能，引導資金投入低碳轉型方案，接軌國際發揮永續影響力。國泰金強調，接續 2050 年淨零碳排首要目標，國泰金控是亞洲第六家通過 SBT 目標審核，也是台灣第一家 RE100 金融業會員，並積極透過 3 項關鍵策略支持減碳轉型行動。第一，「實施高碳排產業管制」，國泰作為台灣首家計算投資組合碳足跡的金融業者，人壽、銀行、產險、證券及投信已訂定逐步撤除煤炭計畫，包含屏除未積極轉型的煤炭價值鏈公司，2022 年國泰投資組合總碳排量較前年降低約 13%。第二，「引導資金投入低碳解決方案」，國泰金控旗下子公司持續透過商品服務，帶動客戶一起投入氣候解決方案，於 2022 年進行低碳投融資共計超過 3000 億元；且為了讓企業承租戶能更容易取得運用台灣的再生能源，國泰人壽以房東角色協助大樓租賃客戶引進再生能源再分配予客戶，提供其充足且便利的再生能源服務，協助產業邁向能源轉型。預估至 2023 年底，全年可轉供約 2000 萬度綠電，減碳約 9900 噸；國泰產險也透過再生能源產業保險，協助再生能源業發展，2022 年針對太陽能、離岸與陸域風場，共新增承保 341.9 億元。第三，「積極倡議與議合創造國際影響力」，除了被動撤資，亦主動議合，國泰金是台灣唯一參與亞洲電廠議合倡議 (Asian Utilities Engagement Program) 的金融機構，發揮金融影響力使能源業加速轉型，已成功議合一家亞洲大型的能源業者承諾 2040 年前淘汰煤炭，並設定 SBT 目標且通過審核。國泰金控已連續七年舉辦國泰永續金融暨氣候變遷高峰論壇，今年與世界氣候基金會 (World Climate Foundation) 締結為全球首家策略夥伴，以東道主身分前進 COP28 藍區主辦會議與論壇，從亞洲代表性金融業者的觀點，與國際氣候趨勢接軌探討加速氣候融資與能源轉型。,https://news.cnyes.com/news/id/5417882,p,為支持碳權交易發展，國泰世華銀行宣布打造並整合收付清算機制，擔任清算行角色，共同完善國內碳權交易機制。預估至2023年底，全年可轉供約2000萬度綠電，減碳約9900噸；國泰產險也透過再生能源產業保險，協助再生能源業發展，2022年針對太陽能、離岸與陸域風場，共新增承保341.9億元。
兆豐金,碳交所今 (22) 日舉行國際碳權交易平台啟動暨首購企業授證儀式，兆豐金為首批國際碳權買家之一，由總經理蕭玉美出席代表授證，強調將全力支持政府邁向碳有價化時代。截至去年底，兆豐銀行已累積發出超過 54.6 萬張「零碳信用卡」，約抵銷 533 公噸二氧化碳排放。兆豐銀自 2020 年起已透過碳權購入，將每一張信用卡升級為零碳信用卡，並取得「ISO 14067 碳足跡認證」和「ISO 14046 水足跡認證」，同時取得環保署「碳足跡標籤」認證。碳交所作為我國官方唯一指定碳權交易機構，於今 (2023) 年 8 月正式揭牌，兆豐金控率先認購國外碳權，積極落實展現 2050 年淨零碳排之決心。蕭玉美表示，因應全球氣候變遷，兆豐集團由內而外積極落實低碳轉型。在營運方面，兆豐金於 2023 年承諾科學基礎減碳目標 (SBT)、宣示 2040 年全面退出燃煤電廠投融資，國內外全據點亦已通過 ISO 14064 溫室氣體盤查第三方查證，國內自有據點亦取得 ISO 14001 環境管理系統、ISO 50001 能源管理系統雙認證，並積極擴大再生能源使用比例。面對國際永續趨勢，蕭玉美指出，兆豐集團將運用碳核算金融聯盟 (PCAF) 方法學盤查範疇三投融資碳排放，偕同子公司訂定投融資減碳行動策略，藉由客戶議合發揮綠色金融綜效。兆豐金控以「發揮正向影響、引領永續發展」為使命，2023 年再度蟬聯 DJSI 世界指數及新興市場指數外，更獲金管會邀請加入「永續金融先行者聯盟」，擔任「金融業淨零推動工作平台」之「跨部門諮詢工作群」召集人。,https://news.cnyes.com/news/id/5417823,p,截至去年底，兆豐銀行已累積發出超過54.6萬張，約抵銷533公噸二氧化碳排放。兆豐銀自2020年起已透過碳權購入，將每一張信用卡升級為零碳信用卡，並取得和，同時取得環保署認證。碳交所作為我國官方唯一指定碳權交易機構，於今 年8月正式揭牌，兆豐金控率先認購國外碳權，積極落實展現2050年淨零碳排之決心。
興富發,台中豪宅市場市場交易走疲，房仲業者實價登錄資料，統計 2022 年 11 月至 2023 年 10 月的近一年，台中市各行政區總價超過 4000 萬元的住宅交易量的變化，顯示台中市全區豪宅交易量年減 39.5%，而建商如興富發 () 也朝豪宅區建案精品化規劃移動。根據台灣央行規定，台北總價 7000 萬元以上、新北總價 6000 萬元以上、其他縣市總價 4000 萬元以上，即符合「高價住宅限貸令」，台中市 4000 萬以上住宅即定義為豪宅。詳細觀察台中市整體豪宅交易量變化，在 2021 年 11 月至 2022 年 10 月期間，就有高達 650 件的交易量，平均一天就有 1.8 件豪宅交易，然而到了近一年來，台中市豪宅交易量僅剩 393 件，驟降了 39.5%。其中萎縮最明顯的為蟬聯豪宅交易量第一的「西屯區」，驟減高達 46.1%，成交件數也從 306 件交易量減至 165 件，近乎腰斬。其餘豪宅交易前四名的行政區，也都有 2-4 成不等的減幅。 中信房屋研展室謝欣亞表示表示，近一年房市氛圍並不熱絡，加上平均地權條例新法規定，限制法人購買住宅須經內政部許可，因此導致高價市場交易緊縮，除此之外，隨台中房價高漲，央行豪宅限貸令衝擊也變大，以西屯區五年的新古屋每坪 65 萬的均價換算，4000 萬元僅能購入 62 坪內的房屋，扣掉公設約是大三房的大小，卻會面臨限貸最高 4 成的緊箍咒，因此有別於過去以大坪數為主力的豪宅市場，目前部分豪宅有往「精品化」趨勢靠攏。 中信房屋中彰投駐區經理楊乾意則指出，受到景氣影響加上打房氛圍不減，整體的豪宅市場受到不少波及，加上台中房價高漲，在蛋黃區內，總價 4000 萬元已經不能算是豪宅，但仍然受制央行豪宅限貸令的影響，導致部分買家會往外移，或是選擇較小一點的坪數，因此也造成整體房市結構的改變。同時，也朝豪宅區建案精品化規劃移動。楊乾意補充說，中台灣有厚實基礎的產業聚落，很多居民是隱形冠軍企業的業主，實力非常雄厚，只要推出的豪宅建商夠知名，座落地段夠好、規劃設計、結構型態具指標性，其實並不缺買家出手置產，像是台中七期豪宅「聯聚怡和」在法拍市場引起搶標也是因為如此。,https://news.cnyes.com/news/id/5417822,n,詳細觀察台中市整體豪宅交易量變化，在2021年11月至2022年10月期間，就有高達650件的交易量，平均一天就有1.8件豪宅交易，然而到了近一年來，台中市豪宅交易量僅剩393件，驟降了39.5%。其中萎縮最明顯的為蟬聯豪宅交易量第一的，驟減高達46.1%，成交件數也從306件交易量減至165件，近乎腰斬。
榮剛,美股反彈收高，台股今 (22) 日在半導體雙雄回神下，指數同步開高震盪，加上面板雙虎、航運股撐住市場人氣，指數在 17600 點上下震盪，拚站穩 10 日線，估量縮至 3000 億元之下，約 2800 億元。航運股今日扮演撐盤要角，貨櫃三雄表現火熱，陽明 () 勁揚逾 4%，萬海 () 也有 3% 漲幅，長榮 () 也拚站穩盤上；航空雙雄均有 2% 以上漲幅；另外，台驊投控、台灣虎航、裕民、亞航等表現也不俗。其他傳產股方面，鋼鐵族群漲多拉回，中鋼 () 早盤紅翻黑，東和鋼鐵、燁興、第一銅、春源、中鋼構、中鴻、豐興等均下跌逾 1%；反觀高興昌、大成鋼則在平盤之上。電子股方面，面板雙雄領軍上攻，群創 () 爆量拉出逾半根停板，友達 () 也有超過 3% 漲幅；其餘光電股包含力特強漲逾 6%，牧德、彩晶、億光、富采、華興、凌巨、達運、佰鴻等也發光。美國記憶體巨擘美光 (Micron) 上季財報優於預期，並重申景氣將反彈，看好記憶體價格一路漲至 2025 年，不過記憶體族群走勢分歧，華邦電 ()、南亞科 () 開高走低，盤中小漲約 1%，旺宏則翻黑震盪。臺灣碳權交易所首批國際碳權今日掛牌交易，相關概念股慶賀，中砂、碩天上漲超過 3%，中華、永豐餘、傑智環境、邁達特、亞泥、台半、森威能源、台達電等都表現不俗。個股方面，榮剛 () 與智冠 () 宣布增發新股方式受讓對方增資發行之新股，榮剛將取得 18.32% 股權成第一大法人股東，榮剛開高走低翻黑，下跌約 2%；智冠開盤隨即打入跌停。,https://news.cnyes.com/news/id/5417741,p,美股反彈收高，台股今日在半導體雙雄回神下，指數同步開高震盪，加上面板雙虎、航運股撐住市場人氣，指數在17600點上下震盪，拚站穩10日線，估量縮至3000億元之下，約2800億元。航運股今日扮演撐盤要角，貨櫃三雄表現火熱，陽明勁揚逾4%，萬海也有3%漲幅，長榮也拚站穩盤上；航空雙雄均有2%以上漲幅；另外，台驊投控、台灣虎航、裕民、亞航等表現也不俗。
萬年清,工業用水與廢水處理工程廠商萬年清 () 將辦理 2019 年上櫃以來進行的首度市場籌資，萬年清並將以發行有擔保可轉換公司債及辦理現金增資案發行 2880 張現增股籌資，此一合計 2 億元的市場籌資案並已向金管會送件。萬年清擬發行有擔保可轉換公司債籌資 1 億元，及辦理現金增資案發行 2880 張現增股籌約 1 億元，現增股並暫訂以每股 35 元溢價發行，這兩項籌資案的主辦券商爲玉山證券。萬年清在去 (2022) 年已簽約金額達 8 億元，工程入帳效應持續發酵中，公司營運並自第二季起由虧轉盈，2023 年前三季營收 2.69 億元，稅後純益爲 524 萬元，每股純益 0.29 元。萬年清目前營收占比仍以內需居多數，台灣占 75%、越南則超過 18%，公司雖然積極擴展海外市場但需要時間發酵，拓點主要跟隨客戶擴廠及資本支出進度，繼越南設立全資子公司後，目前已有實績的印度也有設立子公司規劃。萬年清營收包括兩大區塊，一為廢水處理統包工程類，另一為技術、設備業務，目前萬年清的業務方向在透過全球各地合作，爭取更多專業技術、設備業務的合約。,https://news.cnyes.com/news/id/5417685,p,萬年清擬發行有擔保可轉換公司債籌資1億元，及辦理現金增資案發行2880張現增股籌約1億元，現增股並暫訂以每股35元溢價發行，這兩項籌資案的主辦券商爲玉山證券。萬年清在去年已簽約金額達8億元，工程入帳效應持續發酵中，公司營運並自第二季起由虧轉盈，2023年前三季營收2.69億元，稅後純益爲524萬元，每股純益0.29元。
玉山金,台灣碳權交易所今 (22) 日完成首批碳權交易，玉山金 () 為第二屆永續金融先行者聯盟輪值主席，主動參與購入首批 5000 噸碳權，用於自身金融產品及服務碳中和，以實際作為響應政府 2050 淨零轉型目標。玉山金總經理陳茂欽表示，樂見台灣碳權交易進入下一個新的里程碑，市場機制是邁向淨零非常重要的環節。面對氣候變遷所帶來的巨大挑戰，玉山也將持續努力，透過資金引導加速產業淨零轉型並發揮金融影響力，將轉型的挑戰化為機會，攜手志同道合的顧客與合作夥伴，共同打造美好的淨零家園。玉山金表示，已宣示 2050 年完成淨零，透過長期推動在業務發展過程中結合淨零、減碳思維與行動，首批購入的 5000 噸碳權，將使用在自有大樓及零碳信用卡、零碳 ATM 等金融商品服務的碳抵換，打造零碳金融圈。在營運環境減碳上，自 2017 年起國內外所有營業據點已導入 ISO14064 溫室氣體盤查，針對重點排碳標的加強管理，導入綠建築理念，選用低汙染綠建材、低耗能電器用品及省水標章認證產品，更結合再生能源發展，逐步於行舍屋頂建置太陽能發電設備並導入綠色電力，降低建築耗能、提升能源使用效率並同時降低碳排放。至於信用卡面向，玉山金表示，自 2019 年起即針對每年新發行的信用卡進行碳中和，預計於 2025 年可將玉山市面流通信用卡全數轉換為零碳信用卡。此外，玉山已於 2023 年取得 ATM 交易碳足跡認證，盤查從原料、服務到廢棄等產品生命週期碳排放，並已完成碳抵換，讓顧客在玉山 ATM 的每筆交易都是碳中和的綠色交易。碳權交易所於今年 8 月 7 日正式揭牌，玉山金表示，建立公平國際碳權交易在國際上是一重要議題，在國內透過氣候變遷因應法的實施，並賦予碳權交易所為唯一官方指定碳權交易平台。由碳交所協助過濾碳權來源、確定案場、碳權品質並且提供透明安全交易機制，讓需要碳權的企業能有一公平公正公開管道進行購買及抵銷，加速淨零轉型，也是台灣結合公私部門關鍵資源，共同推動淨零轉型的具體實踐。,https://news.cnyes.com/news/id/5417620,p,台灣碳權交易所今日完成首批碳權交易，玉山金為第二屆永續金融先行者聯盟輪值主席，主動參與購入首批 5000噸碳權，用於自身金融產品及服務碳中和，以實際作為響應政府2050淨零轉型目標。玉山金總經理陳茂欽表示，樂見台灣碳權交易進入下一個新的里程碑，市場機制是邁向淨零非常重要的環節。
鴻海,世界經濟論壇（WEF）於歐洲時間 12 月 14 日公佈最新一批燈塔工廠名單，鴻海 () 旗下鴻佰科技（Ingrasys）桃園南青廠，運用 AI 技術讓生產效率提升 73% 入選，成為全球首家 AI 伺服器燈塔工廠。鴻佰科技（Ingrasys）桃園南青廠主要產品包括 AI 伺服器、HPC 加速器、雲端存儲等產品。這也是鴻海集團繼深圳、成都、鄭州、武漢後，拿下的第五座燈塔工廠。鴻佰科技總經理丁肇邦表示，持續深耕 AI 數位智慧製造系統，深入推動廠內各項自動化、數位化、智慧化與節能化的升級，是鴻佰能快速抓住 AI 產業爆發機遇的關鍵。鴻佰南青廠通過在訂單預測、倉庫和生產調度、產品設計以及品質和組裝測試等領域引入 AI 運算，實現了生產效率提升 73%、產品不良率降低 97%、交貨期縮短 21%、以及單位元製造成本降低 39%。燈塔工廠的稱號係由世界經濟論壇（WEF）和麥肯錫諮詢公司，透過多項嚴謹指標評選，WEF 對鴻佰南青廠給出的評價是，人工智慧基礎模型帶來了對計算能力需求的爆炸式增長，以及對 AI 伺服器更高的效率、品質和反覆運算速度的要求。為全面系統推動 AI 工廠數位化轉型，鴻佰科技在南青廠部署了超過 30 個先進技術案例。其中，在生產經營環節中的五個最核心場景，均導入最先進的 AI 技術。首先是透過 AI 技術的導入，輔助需求預測，讓南青廠在原有基礎上，大幅提升需求預測準確率，也大規模改善產品交付能力。再來通過部署支援 AI、優化智慧倉管系統，縮短了物料準備和訂單分配的時間。第三則是基於 AI 控制與分析的品質管制，使得產品品質檢查及設備維護效率顯著提升，人工壓力大幅降低；第四是引入 AI 驅動的自動化裝配和測試車間，大幅提升設備綜合效率及人均產能。最後搭配 AI 模型建構，加速改善產品參數設計，則讓複雜的 AI 伺服器設計變得高效且更加貼近客戶需求，成為鴻佰伺服器產品定制能力獲得市場廣泛認可的關鍵。,https://news.cnyes.com/news/id/5417558,p,世界經濟論壇於歐洲時間12月14日公佈最新一批燈塔工廠名單，鴻海旗下鴻佰科技桃園南青廠，運用AI技術讓生產效率提升73%入選，成為全球首家AI伺服器燈塔工廠。鴻佰科技桃園南青廠主要產品包括AI伺服器、HPC加速器、雲端存儲等產品。為全面系統推動AI工廠數位化轉型，鴻佰科技在南青廠部署了超過30個先進技術案例。
陽明,台股今 (21) 日終場跌幅收斂，收在 17543 點，下挫 91 點，外資終結連九買，改站賣方，大舉調節聯電、鴻海與友達等個股，但在紅海危機延續下，積極卡位航運股，尤其看好陽明 ()，今日買超張數超過 7 萬張，一舉改寫 16 年來單日買超最高紀錄，更已經連五日加碼，累計加碼金額近 85 億元。三大法人今日合計賣超 80.17 億元，外資終結連九買、賣超 27.68 億元，投信連兩賣、賣超 19.73 億元，自營商呈現連 17 賣、再度調節 32.76 億元；期貨方面，外資期現貨同步做空，加碼空單 6102 口，未平倉空單口數增至 17563 口。觀察買超對象，外資特別青睞航運類股，尤其陽明傳出獲得日商轉單，外資也大舉進場掃貨，終場亮燈漲停，單日買超張數高達 7 萬張，追溯過去紀錄，僅低於外資在 2007 年 2 月 7 日買超的 10 萬張，等同改寫 16 年來新高，累計近五個交易日更大買 16.65 萬張，買超金額將近 85 億元；裕民也獲連六買，累計買超張數達 3.9 萬張。外資賣超則鎖定近期漲多的電子股，包括鴻海、仁寶、和碩、金寶等電子代工廠，賣超張數都在 8500 張以上，聯電也遭調節，張數約 2.2 萬張，其他如友達、精英也都入列賣超前十名。自營商與外資有志一同，同步加碼陽明 5700 張，也買進萬海、慧洋 KY 等航運股，但投信則與外資明顯對作，外資賣超華新、正新與友達各超過 1.2 萬張，投信則加碼三家業者，且買超張數皆超過 1.2 萬張。,https://news.cnyes.com/news/id/5417176,p,三大法人今日合計賣超80.17億元，外資終結連九買、賣超27.68億元，投信連兩賣、賣超19.73億元，自營商呈現連17賣、再度調節32.76億元；期貨方面，外資期現貨同步做空，加碼空單6102口，未平倉空單口數增至17563口。
中鋼,中鋼 () 今 (21) 日召開法說，董事長翁朝棟認為，明年鋼鐵復甦狀況可望優於預期，加上鋼鐵景氣循環大趨勢是 3 年，而上一次中鋼跟同業大賺是在 2021 年，今年已過 2 年，隨著第四季市況開始復甦，明年一定會比今年好、可以期待。翁朝棟表示，世界鋼鐵協會 10 月發布短期鋼鐵需求報告預估（SRO），2024 年全球鋼鐵需求將年增 1.9%，但當時的資料是 8 月蒐集、9 月分析、10 月報告，正是鋼鐵市況不好的時候，而第四季鋼市開始復甦，因此預估明年鋼市狀況可望優於預期。各區域來看，中鋼分析，北美建築需求受基礎建設政策帶動而回溫，汽車產銷量已恢復成長；歐洲受益於低基期，鋼鐵需求有望迎來較大反彈，不過，消費降速為潛在風險；中國房市量能維持低檔，不過，汽車與家電支持製造業復甦，鋼需有望回溫；印度及東南亞需求升溫，將扮演 2024 年成長箭頭。中鋼認為，終端需求緩步回升、市場信心情緒逐漸轉好，第四季鋼市有感回溫，第一季雖然因為春節工作天數少，但仍可穩定向上，第二季則是關鍵，需密切關注美國金融緊縮，以及中國不動產市場發展，但整體而言，鋼需低谷已過，鋼市溫和復甦。原料走勢方面，中鋼指出，煤礦因歲末部分澳洲礦區放緩採礦、加強安檢，市場預期供給減少，印度用鋼內需旺盛，當地鋼廠高價購煤推升價格，中國礦災頻傳，限縮國產煤產量。鐵礦雖然因中國發改委調查導致價格一度震盪下行，但在高爐廠稼動率高，以及鋼廠及中間商開始補庫存，支撐價格。,https://news.cnyes.com/news/id/5417165,p,翁朝棟表示，世界鋼鐵協會10月發布短期鋼鐵需求報告預估，2024年全球鋼鐵需求將年增1.9%，但當時的資料是8月蒐集、9月分析、10月報告，正是鋼鐵市況不好的時候，而第四季鋼市開始復甦，因此預估明年鋼市狀況可望優於預期。
裕隆,裕隆 () 今 (21) 日發布重訊指出，為簡化公司轉投資架構，將清算解散上一層重要子公司裕隆大陸投資有限公司，為對股東權益或證券價格無重大影響。裕隆說明，轉投資公司東風裕隆汽車已於 2022 年 12 月 30 日經法院裁定核准破產重整計晝，並於今年 6 月完成破產重整程序。裕隆此次是為簡化公司轉投資架構，將清算解散上一層重要子公司裕隆大陸投資公司 (YULON CHINA INVESTMENT LIMITED)。裕隆集團近年持續調整在中國市場布局，除了納智捷品牌退出，裕隆董事會日前也決議處分持有裕隆汽車金融 (中國) 51% 股權，裕融 () 則處分裕隆汽車金融 (中國)49% 股權。裕隆表示，集團部份發展資源未來將轉向與鴻海 () 的電動車合作。,https://news.cnyes.com/news/id/5417130,n,裕隆今日發布重訊指出，為簡化公司轉投資架構，將清算解散上一層重要子公司裕隆大陸投資有限公司，為對股東權益或證券價格無重大影響。裕隆說明，轉投資公司東風裕隆汽車已於2022年12月30日經法院裁定核准破產重整計晝，並於今年6月完成破產重整程序。裕隆此次是為簡化公司轉投資架構，將清算解散上一層重要子公司裕隆大陸投資公司。
中鴻,中鴻 () 今 (21) 日召開法說並開出明年 1 月內銷及 2 月外銷盤價，內銷方面，熱軋、冷軋每公噸調漲 500 元、鍍鋅調漲 800 元；外銷則依產品及地區別調漲 30-50 美元，實際報價視當地市場行情而定。中鴻總經理朱敏則指出，明年營運基調為穩定，預估 2024 年銷售量將在 185 萬噸左右，持平今年，後市除了觀察美國利率政策走勢，也要留意俄烏戰爭、以巴衝突走勢，只要其中一場戰事停止，重建需求就會浮現，為鋼鐵市況帶來進一步回溫的機會。總體經濟來看，中鴻表示，隨著歐美通膨持續改善，12 月份聯準會（Fed）繼續維持利率不變，並傳遞結束升息、明年降息 3 碼的訊號，顯示全球貨幣政策轉折將近。中國大陸方面，官方增發 1 兆元 () 國債提振經濟，政策延續寬鬆，預計人行明年仍將啟動降準、降息，有望帶動消費及投資需求回升，全球經濟將可保持穩定成長。另外，中國六大國有銀行日前完成與房地產企業座談，並積極表態支持房企融資，除可防範及化解風險，亦有助推動產業轉型，包括加速保障性住宅等「三大工程」建設，將有利後續鋼鐵需求回升。供給方面，中鴻表示，先前各國鋼廠在成本高漲壓力下，紛紛進行歲修或調節產量，歐洲 ArcelorMittal 等鋼廠亦陸續關停高爐並提價因應；中國國統局 11 月粗鋼日均續創年內低點為 253.67 萬噸，連續五個月下降，鋼鐵供給持續收縮，減產效應逐步顯現。中鴻認為，鋼市供需明顯改善，煉鋼成本保持高位，指標鋼廠亦相繼開出紅盤，為貼近國際行情並反映鋼市展望，本次內外銷盤價順勢調漲。以產品組合，中鴻前三季產品營收占比，熱軋 83.64%、冷軋 14.07%、鋼管 2.29%。,https://news.cnyes.com/news/id/5417115,p,總體經濟來看，中鴻表示，隨著歐美通膨持續改善，12月份聯準會繼續維持利率不變，並傳遞結束升息、明年降息3碼的訊號，顯示全球貨幣政策轉折將近。中鴻認為，鋼市供需明顯改善，煉鋼成本保持高位，指標鋼廠亦相繼開出紅盤，為貼近國際行情並反映鋼市展望，本次內外銷盤價順勢調漲。以產品組合，中鴻前三季產品營收占比，熱軋83.64%、冷軋14.07%、鋼管2.29%。
