2024/01/24,19:59,富晶通去年12月虧損收斂65% 全年每股虧0.33元,富晶通,觸控面板廠富晶通 () 今 (24) 公告去年 12 月自結稅後純損 203 萬元，每股純損 0.07 元，較前月及去年同期收斂 65%，全年每股虧 0.33 元，持平前年。富晶通去年 12 月營收 2426.3 萬元，月減 5.2%、16.9%；第四季營收 8086 萬元，季減 9.8%、年增 6.7%；全年營收 3.68 億元，年增 3.2%。富晶通先前已公告去年 10-11 月自結稅後虧損 537 萬元、每股純損 0.18 元，加計 12 月自結，第四季稅後純損 740 萬元，每股純損 0.25 元。若加計去年前三季財報，富晶通去年稅後純損 984 萬元，每股純損 0.33 元，持平 2022 年的水準。,https://news.cnyes.com/news/id/5436946
2024/01/24,19:58,日月光馬來西亞四廠啟用 五廠竣工生產面積翻倍,日月光投控,日月光投控 ()() 旗下日月光今 (24) 日宣布，馬來西亞檳城四廠與參觀中心已正式啟用，其主要生產產品以銅片橋接 (Copper clip) 和影像感測器 (CIS) 封裝量產線為主，也會同時布局先進封裝產品。日月光在 2022 年 11 月宣佈，將在五年內投資 3 億美元，擴大馬來西亞生產廠房與採購先進設備，日月光指出，未來四廠與五廠加入後，生產空間將翻倍成長至 200 萬平方英尺。日月光馬來西亞預計未來將繼續專注生產銅片橋接與影像感測器等大量封裝產品，同時計劃開發先進封裝技術，且隨著參觀中心完工，已準備好接待客戶，強化與供應商、合作夥伴的參與，並推動進一步創新。此外，由於各家 IDM 皆積極在馬來西亞擴充產能，當地封測需求也日漸增加，日月光除了檳城四廠與五場規劃外，也加碼投資馬國，目前已取得馬來西亞檳城州桂花城科技園土地使用權，將進一步擴大布局先進封裝。,https://news.cnyes.com/news/id/5436937
2024/01/24,19:17,國泰金擴增雲端版圖 國壽、產險加入共近50套系統上雲,國泰金,國泰金 () 領先業界自 2020 年啟動集團雲端轉型計劃，近年持續擴增版圖，2023 年因應金融三業委外上雲辦法鬆綁，國泰正式迎來大規模上雲潮，在法規賦予的彈性之下，包含國泰人壽、國泰產險在雲端布局上都取得指標性進展，總計完成將近 50 套應用系統上雲。金融業上雲是大勢所趨，國泰金表示，做為台灣金融業數位轉型、啟動金融上雲的先行者，已做足完善上雲準備、累積豐富經驗，並嚴謹落實雲端治理。資深副總經理姚旭杰指出，在系統架構上，我們以設計現代化雲端架構為目標，透過雲地混合管理架構，確保雲端與地端現行架構系統的整合更為順暢。在資安防護上，國泰金特別針對資料儲存與傳輸、檔案存放、權限控管加以考量，以保障客戶資訊安全；至於人才培育，則提供豐富雲端訓練課程，培養人才雲端技能；最後，金融業上雲首重合規，國泰持續因應主管機關指導，加速修訂內部審核機制，以達到風險控管目的。近年積極投入數位轉型的國壽於 2022 年展開第一階段上雲計劃，從基礎建設、應用程式現代化兩面向著手，並與金控緊密合作，挑選適合搬遷上雲的關鍵先行系統。國壽副總經理王富民表示，綜合考量商業價值、技術成本、風險程度三項指標後，目前國泰人壽已將 17 套自有系統遷移上雲，為國內保險業數一數二浩大的規模，其中包含活動網站，以混合雲架構因應行銷活動瞬間產生的龐大流量；以及機場旅平險投保系統，運用雲端資源串連地端核心系統，協助機場客服人員一站式完成保單受理及核保流程，減低地端設備維護時的服務影響。    國泰產險的上雲起點則是智能商險平台 (SmartBiz)，該系統是以數據驅動協助業務員為中小型商家快速組合與推薦保險商品。國泰產險督導陳信良指出，由於該系統採用完整微服務架構、前後端分離設計，所使用的容器化平台及資料庫系統均與雲原生環境相容，整體遷移成本最低，也是國泰產險首次將即時性交易系統上雲。,https://news.cnyes.com/news/id/5436936
2024/01/24,18:38,長榮航與機師工會達5個協議 1/31再次協商,長榮航,長榮航 () 今 (24) 日與桃園市機師職業工會 (機師工會) 於桃園市勞動局協商，雙方持續凝聚共識，達成五個協議，並訂於 1 月 31 日再次召開協商會議。長榮航與機師工會今日協商會議決議有五大項，第一，公司同意落實提供外站免費早餐政策：機師抵達外站飯店，於該飯店早餐供應時段均可在該飯店免費享用早餐。第二，公司會優先考量員工健康福祉及留才久用，因應國外物價上漲，給予機師於外站工作有充足福利，強化外站福利政策及檢討薪資結構。第三，公司會儘速完成再提高副駕駛及資深副駕駛最高薪級上限評估，並作出回應。第四，下次會議新增討論「停止直接新聘外籍正駕駛」議題。第五，若公司有具體對應方案，擬訂於 1 月 31 日下午 2 時，會同勞動部、交通部、民航局再次召開會議，針對工會訴求提出具體進度及可行方案，由有決策權人員出席與會。長榮航指出，在今日的協商基礎上儘速擬定對案，與工會進行下次協商，感謝近日相關主管機關主動關心並居中協調，期待與工會儘快形成共識，達到公司、員工和旅客三贏的解決之道。,https://news.cnyes.com/news/id/5436869
2024/01/24,18:31,神準多項新產品Q1陸續出貨 股價攻上漲停,神準,網通廠神準 ()WiFi 7 產品、400G 乙太網路交換器以及 25G/50G/100G x86 智慧網卡等產品將陸續在第一季出貨，激勵神準股價今 (24) 日開高走高後，亮燈漲停鎖住 247.5 元，站上 5 日線。 神準股價今日以 228.5 元開高走高後，於午盤攻上漲停鎖住 247.5 元，成交量 2297 張，站上 5 日線且突破月線。 神準董事長蔡文河先前於法說會指出，WiFi 7 企業及基地台預計將在今年第一季陸續出貨，且預估今年底 WiFi 6 將與 WiFi 7 的交叉點將出現。資料中心是神準一大發展重點，蔡文河提到，400G 乙太網路交換器以及 25G/50G/100G x86 智慧網卡也會在第一季陸續出貨。5G FWA 無線固網方面，則聚焦印度市場，預計今年第二季開始部署。AIoT 中的 AI 影像處理監控及門禁系統，則預計在今年第三季量產。 不過，神準先前為充實營運資金以及償還銀行借款辦理現金增資，目前適逢增資作業的緘默期，尚未釋出今年最新展望。 神準去年 12 月營收 10.18 億元，月減 25.6%，年減 45.14%。累計 2023 全年營收 166.09 億元，年增 1.76%。,https://news.cnyes.com/news/id/5436868
2024/01/24,17:43,宏碁擴大布局顯卡市場 再推新品搶市,宏碁,宏碁 () 擴大布局顯示卡市場，宣布 Nitro 產品線正式登場，率先引進最新超微 (AMD) 發表的 Radeon RX 7600 XT GPU，首款 Nitro Radeon RX 7600 XT OC 顯示卡也預計今 (24) 日晚上在全球同步發售。全新 Acer Nitro Radeon RX 7600 XT OC 顯卡配置 16GB GDDR6 記憶體、288 Gbps 頻寬、高達 2539MHz 遊戲時脈和 2810MHz 超頻時脈速度，釋放 GPU 最大效能。此外，具備新一代 AMD RDNA 3 架構，以 AI 技術和光線追蹤加速器享有流暢的畫面解析度和高刷新率體驗；借助加速渲染應用程式支援進行編輯及視覺化，同時也能支援 AMD 編碼 / 解碼媒體引擎，可於播放或串流時提供動態色彩範圍和強化畫面，並支援 DirectX 12 Ultimate API，展現沉浸式且生動的視覺效果。宏碁表示，此顯卡的散熱技術提升，直徑 87mm 的 Nitro FrostBlade 環形風扇，環形設計可增加風壓，提高風流有效發散 GPU 熱量，並降低運轉噪音；雙滾珠軸承系統較傳統油封軸承，使用壽命長並能承受高溫；上、下、背面的三大散熱通風口能有效冷卻裝置上的重要零件。,https://news.cnyes.com/news/id/5436853
2024/01/24,17:36,英業達攜手信昌明芳 大秀智慧座艙產品,英業達,英業達 () 攜手信昌明芳，展示全新智慧座艙產品，呈現機電整合智能產品的最高水準，並導入了英業達的資訊娛樂系統 (IVI)，提供全面的智慧型使用者介面，駕駛可以更直覺的操控天窗與後座的智慧車窗。 信昌明芳指出，展車核心來自英業達的 IVI 系統，IVI 為 HCMF 的玻璃 Micro LED 顯示螢幕提供使用者可以更直觀的控制，這些顯示屏安裝在後側車窗以及全景天窗中，此外還有無線充電系統供使用者使用。 英業達的 IVI 系統與 HCMF 的車頂、車門以及關閉機制之間的結合，使得智慧移動的發展前進一大步。信昌明芳也提到，成功將 Micro LED 顯示器做到業界唯一可升降的玻璃，落實透明智慧車窗，以滿足客戶多元化的需求。 擁有 60 年機構產品經驗的信昌明芳指出，持續與台灣知名企業展開深度合作。英業達在車用電子中，致力於提供客製化的軟硬體結合系統，滿足客戶各種需求，英業達也持續推動汽車電子的發展。,https://news.cnyes.com/news/id/5436843
2024/01/24,17:28,研華檳城亞太共享服務中心落成 區域核心競爭力提升,研華,"工業電腦大廠研華 () 今 (24) 日宣布，為提升亞太地區服務範疇，正式於馬來西亞檳城設立亞太共享服務中心（Advantech ASEAN Shard Service Center, ASSC），並與越南石油集團 Petrolimex 旗下系統整合商 Piacom 簽訂合作意向書（Letter of Intent，LOI）展開亞太服務中心的首件服務專案。研華亞太暨海外新興市場區域總經理張敏忠表示，於檳城設立亞太共享服務中心是研華落實「中國 + 1」策略的第一步，也希望能有效實現產業深耕與落地，以及強化區域核心競爭能耐與在地化服務等目標。張敏忠進一步補充，此次與越南石油集團 Petrolimex 旗下系統整合商 Piacom 針對加油站產業簽訂合作意向書，共創合作軟 + 硬的完整解決方案（Solution Ready Package），即象徵研華在區域所建置的產業方案集成團隊，能有效協助產業用戶專案落地與深耕。研華亞太共享服務中心除提供一般區域客戶維修服務、擁有兩條產品組裝，以及專案整合與技術諮詢顧問外，並將重點服務泰國、越南、印尼等東南亞國家客戶，也將協助其他亞太市場包括巴基斯坦、菲律賓等有數位轉型與 AIoT 技術需求的客戶。研華表示，亞太共享服務中心的成立不僅象徵研華擴大亞太市場佈局，更將進一步聚焦在地人才培育、產學合作、工程集成，並加深與亞太地區共創夥伴合作解決方案。研華也同步啟動產學共創全球拓展計劃（University Co-Creation Worldwide Expansion Plan，UCC），預計於兩年內與全球大專院合作建立 12 間 AIoT 實驗室，期望在物聯網市場蓬勃發展及人才需求熱點區域，從產學合作、在地服務，到最終實踐產業深根與落地的策略目標，形成完整人才發展生態系。研華 UCC 全球拓展計劃包含以標準化物聯網課程模組（Course Module + open/online courses），以及提供實作教材（Training Kit）與經費支持夥伴大學建立物聯網指標實驗室的 AIoT Lab、物聯網專題競賽的 Innoworks、創新專題式實習的 Elite 100 Internships，以及與策略實驗室合作進行特定物聯網方案／技術創新研究的 Research Project 等四大產學合作計畫方案。",https://news.cnyes.com/news/id/5436806
2024/01/24,17:19,晉弘拋棄式膀胱鏡 獨家授權國際醫材大廠波士頓科學,晉弘,醫材廠晉弘 () 今 (24) 日宣布，旗下拋棄式膀胱鏡產品授權給全球知名醫材大廠波士頓科學 Boston Scientific，該產品將以商品名 VersaVue 進行全球獨家銷售。晉弘開發的拋棄式膀胱鏡產品甫通過美國食品藥品監督管理局 (FDA)510(k) 審查，是用於下泌尿道部位的內視鏡檢查或輔助治療，可拍攝下泌尿道的組織結構、提供即時高畫質的影像，讓醫療人員對組織損傷或病變情形進行評估，相較可重複使用的膀胱鏡需經過消毒等過程，拋棄式膀胱鏡從無菌包裝拆開直接使用可降低交叉感染風險。晉弘表示，公司掌握拋棄式內視鏡的微型鏡頭影像感測模組和封裝的關鍵技術，此次能夠獲得國際大廠青睞，由知名品牌大廠波士頓科學 Boston Scientific 透過其銷售通路進行推廣，再次展現 MIT 厚實的開發製造能力。晉弘董事長鄭竹明表示，此次與波士頓科學 Boston Scientific 合作，學習到國際大廠在作業流程的嚴謹和品質管理的要求，晉弘的經驗值也因此大幅提升。,https://news.cnyes.com/news/id/5436835
2024/01/24,16:59,【量大強漲股整理】台北國際電玩展登場下，潛力股該留意誰?,台積電,台股高檔量縮，尾盤承受賣壓，終場上漲 1.24 點，成交量 2651.55 億元。看一下三大法人: 外資買超 19.45 億元；自營商賣超 5.03 億元；投信賣超 21.69 億元；三大法人合計賣超 7.27 億元。美股漲多跌少，台股今日開高後，挑戰月初前波高 17956 點，甚至重返萬八大關，不過盤中 AI 熄火，() 台積電午後翻黑，台股 17900 點得而復失之下，呈現回檔，最後一盤拉上紅盤，雖然今日黑 K 棒但量縮，且外資持續偏多，連四日，合計買超逾千億元之多，都有利於未來的行情；大型電子交投清淡下，中小型股匯聚人氣，資金聚焦在 PCB 族群中；遊戲族群也因為台北國際電玩展登場下有所表現；本周持續觀察美國經濟數據，GDP、PCE、下周將進入美國聯準會 (Fed) 利率決策會議，雖然今年聯準會降息路徑仍有不確定性，3 月降息恐延至年中，但寬鬆態度預估不變；市場轉為觀望氣氛，呈現萬八附近高檔震盪，2024 年半導體復甦帶動有戲，其他族群都在庫存調整，AI 較具有創新商機，只要跟 AI 沾上邊的都有機會，後市台股續漲仍可期。個股方面，() 台積電，平盤震盪，收 627 元；() 聯發科，今天走勢穩定，爲大盤穩盤要角，上漲 2.74%，月底將登場法說會，有機會往填息之路邁進；1-25-1/28 為「2024 台北國際電玩展」，() 智冠、() 華義，雙雙漲停，() 歐買尬，盤中一度攻上漲停，收盤上漲 4.92％、() 網龍，則上漲 1.93%；在 PCB 族群中，() 新復興，看好今年有 5G 基地台及低軌衛星相關產品出貨推升營運，股價最為強勢，盤中亮燈漲停，收 48.4 元、() 華通，上漲 1%，重返七字頭大關；AI 概念股多數走疲，僅 () 宏碁、() 技嘉，收小紅；() 達發，衛星定位系列晶片獲得車規級 Grade 2 認證，取得 Tier-1 供應鏈門票，終場上漲 4.79%。都在影片分享給你知道 1/24【上市強勢股分享】() 宏致() 悅城() 志聖() 晶彩科() 洋華() 昶虹() 正達() 中釉() 訊舟() 蔚華科() 凌巨() 海華() 華東() 高林() 達發1/24【上櫃強勢股分享】() 新復興() 聰泰() 擎亞() 亞矽() 律勝() 尚立() 智冠() 環天科() 方土昶() 歐買尬() 東捷() 福華() 凱碩() 鈊象() 力致想持股診斷或詢問盤勢分析請免費訂閱股市期皇后 莊佳螢莊佳螢分析師:每日分享盤勢解析跟精選產業個股，讓投資朋友輕鬆追蹤 2024 年台股操作方向，相關詳細內容請加入 Line@索取，免費提供給您!股市期皇后 證期雙分析師 莊佳螢LINE 官方帳號LINE ID 搜尋: @winner168 (@不可省略)或是點擊下方網址加入Youtube 影音頻道 精彩解盤影片不容錯過!(記得按讚，訂閱並打開小鈴鐺)FB 粉絲團:【股市期皇后】文章來源: 摩爾投顧莊佳螢分析師本公司所推薦分析之個別有價證券無不當之財務利益關係 以往之績效不保證未來獲利投資人應獨立判斷 審慎評估並自負投資風險,https://news.cnyes.com/news/id/5436807
2024/01/24,16:55,PMIC庫存水位降 力智、矽力-KY後勢看旺,力智,隨著通路商及自身庫存水位已趨於健康水準，PMIC 族群降價壓力逐漸減小，外矽力 *-KY()、力智 () 營運展望佳，預期 Q1 產品降價幅度僅在低個位數之間，全年營收年增率有機會成長 2 成，營運表現可望優於同業。過去一年 PMIC 廠也在經歷庫存去化，目前多數品項庫存水位大致已降至合理水位，不同料耗庫存去化程度不一，預期今年上半年庫存去化速度會趨緩，電源管理 IC 廠為維持在晶圓廠一定投片數量，維繫與晶圓廠合作關係及生產成本，多已陸續恢復投片量並藉此開新案。英特爾及 AMD 伺服器 CPU 新平台出貨量增，力智 () 營運動能逐漸恢復，營運可望重回成長軌道，尤其電源管理晶片新品推出產品組合優化，2024 年毛利率可望回升至 40% 以上。下半年終端市況有回溫趨勢，運算平台之主機板、顯卡、筆電通路庫存降低，成長趨勢可延續至年底，且 2024 年 PC/NB 在新品帶動、AIPC 及 windows 10 停更後，可望帶動企業換機潮，2024 年對力智新產品滲透度將有所提升。全球第二大電源 IC 供應商亞德諾半導體（ADI）前日向客戶發出漲價通知，預計 2024 年 2 月調高售價，漲幅估計在 10～20％之間，力智 ()、矽力 *-KY() 也有望受惠。這將加速既有客戶導入單價較高的新產品，使電源管理 IC 市場價格全面回溫。力智 2024 年出貨將逐步回溫，由於運算平台的主機板、顯卡、筆電通路庫存降低，成長趨勢可延續至年底，明年在 PC／NB 新品帶動、AI PC 及Ｗindows 10 停更助攻下，預期出貨將逐步回溫。英特爾及 AMD 伺服器 CPU 新平台出貨量增，明年伺服器市場有望成長，預估有 3～4 成成長空間。力智也將推出新一代伺服器、資料中心與 GPU 平台的 SPS（智慧功率模組）產品，增添明年營運動能。儘管今日 PMIC 走勢偏弱，法人連續賣超多日，但股價經過修正後投資價值反而浮現，投資人可以半年線為分水嶺，不跌破半年線，就還有反轉的機會。想要跟著我一起學習基本面，掌握產業趨勢的，歡迎訂閱股海大丈夫的 YT 頻道：想要掌握第一時間股市資訊，只要加入股海大丈夫 Line@ 就可以得到第一手消息專人諮詢服務：02-2542-9977YT : 文章來源：永誠投顧陳建誠分析師本公司所推薦分析之個別有價證券無不當之財務利益關係 以往之績效不保證未來獲利投資人應獨立判斷 審慎評估並自負投資風險,https://news.cnyes.com/news/id/5436804
2024/01/24,16:31,光環子公司普瑞光電調整銷售策略 認列資產減損8508萬,光環,光通訊廠光環 () 昨 (23) 日公告，依國際會計準則第 36 號公報進行資產減損評估，將子公司珠海保稅區普瑞光電科技有限公司因銷售策略調整後，閒置的資產約 8509 萬元認列減損。 光環強調，此次認列資產減損損失不涉及現金流量，對公司的營運資金並沒有影響。 光環先前於法說會時指出，今年第一季由於是傳統淡季，因此會是營運谷底，不過在迎接第二季旺季後應會逐漸往上，預期光通訊產業將會在第三季逐漸走出谷底。代工方面，光環也指出，今年下半年需求有望增溫，帶動代工營收占比有望提升至 10%。,https://news.cnyes.com/news/id/5436789
2024/01/24,14:42,台股「積」情助攻ETF除息行情 這5檔僅花3-4天填息,台積電,台股「積」情再起，大盤站回月季線之上，也激勵上周進行除息的台股 ETF 行情表現，目前已有 5 檔成功完成填息，其中，月配息型的復華台灣科技優息 ()、追蹤大盤為主的元大台灣 50()、中信臺灣智慧 50() 3 檔僅花了 3 天就順利填息。根據 CMoney 統計，上周有 13 檔台股 ETF 進行除息交易，除了 00929、0050、00912 外，半年配的元大 MSCI 台灣 () 及季配的永豐台灣 ESG() 表現也很突出，這次僅 4 天就完成填息。近一步分析這些填息的 5 檔 ETF，00929 本月配息金額從 0.11 元增加至 0.13 元，因填息缺口相對較小，加上成分股聚焦半導體、電子零組件及電腦周邊設備等熱門 AI 供應鏈題材，3 天完成填息，累計從去年 7 月配息以來，除 12 月尚未填息外，其餘當月填息天數都只花 1 天。0050、006203、00912、00888 權重第一大皆為台積電，其中占 0050、006203 占比超過 4 成、00912、00888 逾 2 成，隨台積電股價跳升大漲，成為此次完成填息的主要功臣。其餘 9 檔 ETF 雖處於貼息狀態，不過，隨著盤勢翻多、電子股同步走揚，包括聚焦半導體、5G 等 ETF 都離填息僅一步之遙。投信法人表示，台積電為台股權值第一大，因法說會報佳音推升股價重返 600 元大關，讓以追蹤大盤為主的台股 ETF 雨露均霑，加上又是熱門 AI 概念股的領頭羊指標，也將挹注以趨勢電子產業為主的台股 ETF 表現空間。復華台灣科技優息 ETF 經理人許忠成表示，AI 趨勢帶動科技業景氣擴張循環，台廠在供應鏈扮演重要角色，加以半導體及其他產業庫存調整結束，隨庫存陸續回補、手機及 PC 等消費性電子需求回溫、景氣逐步回升，預計將帶動相關受惠概念題材及台股大盤表現空間，建議可透過一籃子電子股佈局的台股 ETF 掌握後市投資契機。,https://news.cnyes.com/news/id/5436695
2024/01/24,12:29,〈焦點股〉宏致大啖AI商機營運逐季升溫 股價奔漲停,宏致,連接器線廠宏致 () 大啖 AI 商機，不僅打切入台系、美系 AI 伺服器製造商供應鏈，也拿下國內品牌商 AI PC 電源供應器獨家訂單，今年營運可望逐季向上，利多加持下，股價今 (24) 日也直奔漲停 34.9 元。宏致表示，去年營收因庫存修正影響而下滑，因此同步調整面對未來的策略，推動一系列關鍵技術與產品創新，加上未來 AI 潮流興起，市場對於高速傳輸的需求不斷攀升，在 AI 伺服器及 AI PC 領域，目前 PCIe Riser Cable 已經開始交貨。高速傳輸方面，宏致 800Gbps 的 AEC 線纜也完成開發，公司看好，800Gbps AEC 具有不需進行光電轉換及傳輸速度快的優勢，取代主動式光纖纜線（AOC）單價昂貴且功耗高的缺點，將能為客戶提供更經濟與高效的解決方案。法人預估，宏致第一季因受到過年因素，營運動能估仍較平緩，但第二季起 AI 新品逐步出貨，營運可望轉盈，下半年也將逐季向上，公司今年營收可望回到疫情前百億元的水準。宏致也強化品質管控、智慧製造能力，品質管控將以目前使用自動光學檢測（AOI）為基礎，運用機構、成像及解決方案技術，實現對產品的精準測試，消除重測時間及人力成本，大幅提升製程、組裝良率及生產效率，未來將導入 AI 檢測模式，以高水平的品質管控提升檢測精度。在智慧製造上將以製造執行系統（MES），實現數據中心化管理，運用數據中台掌握各機台的稼動率、良率等關鍵生產數據，將透過智慧製造柔性生產的機制，全面提升製程管控能力與靈活性。,https://news.cnyes.com/news/id/5436649
2024/01/24,12:13,智擎胰臟癌新藥一線用藥 美國藥證結果有望下月出爐,智擎,智擎 () 授權夥伴 Ipsen 所申請的胰臟癌新藥安能得 (ONIVYDE) 一線用藥美國藥證，其結果有望在下 (2) 月中旬出爐，若 Ipsen 順利取得美國藥證，將為智擎的歐洲與台灣藥證添翼。智擎旗下胰臟癌新藥安能得一線用藥是治療轉移性胰腺癌，並有歐亞地區權利，其中，台灣是自行申請藥證、歐洲則是由 Servier 公司負責。另外，美國是透過合作夥伴 Ipsen 來申請藥證。雖然智擎不具有美國銷售權利，不過美國藥證結果也會間接影響歐洲、台灣藥證審查。Ipsen 去年 7 月提出美國藥證申請，由於具有快速審查資格，因此審查時程可縮短至半年左右，若審查一切順利 2 月中旬美國藥證有望取證。智擎表示，若美國藥證結果正向，預期台灣、歐洲藥證會在第二季起陸續取證，其中，歐洲藥證到手時，最快第二季底、第三季初認列里程碑金。其他市場部分，智擎去年開始拓展中國市場，儘管主要銷售自費市場，尚未納入當地醫保 (相當於台灣健保)，不過今年銷售量有望進一步提升。整體來看，智擎今年有三大成長動能，包含既有市場持續擴大、中國市場貢獻逐漸增加，以及歐洲與台灣一線用藥下半年有營收貢獻，不過去年認列里程碑金、墊高基期，今年本業營收有望優於 2022 年。,https://news.cnyes.com/news/id/5436641
