2024/01/24,11:58,〈台股盤中〉聯發科、傳產撐盤站上17900點 逼近前高資金觀望量能縮,聯發科,台股今 (24) 日高檔量縮，聯發科、傳產族群扛起撐盤大旗，早盤最高來到 17944 點，上漲 70 點，中午前雖然漲點收斂，但仍暫時站在 17900 點之上，不過，由於接近前高 17956 點，追價買盤觀望下，今日估量僅 2600 億元。觀察今日電子權值表現，台積電、鴻海平盤震盪，聯發科漲逾 2%，撐起大盤漲勢，AI 股漲跌互見，和碩、宏碁漲逾 2%，技嘉也同步走揚，但緯創、仁寶下挫，面板雙虎也不同調，群創漲約 2%，友達平盤下震盪。股王世芯 - KY 跌 1%，IC 設計相關的祥碩、創意、智原跌 2-3%，矽力 *-KY 也走弱，不過，IC 通路商文曄、大聯大持穩；高價股跌多漲少，旭隼跌 4%、川湖、緯穎跌 2-3%、嘉澤失守千元大關，大立光、亞德客 - KY 均漲 1%，在高價股中一支獨秀。大型電子交投清淡下，中小型股匯聚人氣，PCB 族群中，新復興午盤攻上漲停，楠梓電、育富、華通、定穎投控、泰鼎 - KY、瀚宇博、敬鵬、高技等表現不俗；網通族群也表現強勢，海華、訊舟等也漲逾半根停板。傳產指標今日多有表態，重電指標華城盤中漲逾 2%、大同也小漲，台塑四寶聯袂上漲，台化表現尤佳，航運股也全面向上，貨櫃三雄、航空雙雄都有 1-2% 的漲幅，其他傳產指標如正新、潤泰新、中鋼也有撐。,https://news.cnyes.com/news/id/5436629
2024/01/24,11:57,台積電3奈米製程發威 拉升去年Q4整體ASP年增22%,台積電,外媒 Tom’s Hardware 指出，儘管半導體產業景氣低迷，但台積電 ()()12 吋晶圓代工平均售價 (ASP) 在去年第四季達 6611 美元，較前年同期增加 22%，主要即是受惠高單價的 3 奈米製程進入量產，拉升整體平均售價。依據台積電去年第四季晶圓出貨量數據來看，12 吋晶圓出貨量為 29.57 億片，低於 2022 年第四季的 37.02 億片，出貨量大幅下降 20.1%，也是 2020 年以來首次低於 300 萬片。但若從營收來看，台積電營收僅略微下降，去年第四季營收 196.2 億美元，年減幅僅 1.5%，等同每片 12 吋晶圓平均售價為 6611 美元，高於 2022 年第四季的 5384 美元。分析師估計，台積電每片 3 奈米晶圓售價可能高達 2 萬美元，儘管數字不完全準確，但整體售價會再比 5 奈米家族 (N4/N5) 或 7 奈米家族 (N6/N7) 還要貴。伯恩斯坦研究資深分析師史黛西 · 拉斯貢 (Stacy Rasgon) 表示，晶圓代工新節點的價格增加，是推動近年半導體產業成長的主要動力，預期隨著時間推移，新的製程節點技術會變得越來越昂貴。觀察 2019 年到 2023 年，儘管晶圓總出貨量實際上有所下降，但平均售價 (ASP) 卻大幅增加，為晶圓代工廠帶來更多的營收成長。觀察台積電去年第四季財報，3 奈米晶圓收入的營收比重達 15%，5 奈米、7 奈米分別貢獻 39% 和 17%，依絕對金額來看，3 奈米貢獻 29.43 億美元的迎收，5 奈米貢獻 68.67 億美元的營收，7 奈米挹注 33.354 億美元的營收。整體而言，台積電的先進製程節點包括 7 奈米、5 奈米與 3 奈米佔整體營收的 67%，若以基於 FinFET 的製程技術來看，營收更佔台積電晶圓營收的 75%。,https://news.cnyes.com/news/id/5436631
2024/01/24,11:25,〈金龍年招財術〉上海商銀贈高資產客戶錢母 完成任務免費領發財金、發財水,上海商銀,金龍年將至，上海商銀 () 舉辦多項賀新春活動，將延續兔年廣受好評的首發錢母熱潮，再次針對高資產客戶發行龍年錢母，祝福客戶財運滾滾來，此外，即日起至 2 月 23 日，客戶前往全台任一分行，出示在上海商銀提款或轉帳 1000 元證明，即可兌換發財金或發財水一份，送完為止。上海商銀說明，今年的錢母以祥龍與牡丹為設計主軸，搭配今年即將落成啟用的新鑽石總行大樓圖樣，象徵「龍」華富貴 (諧音榮華富貴)，吉祥又喜氣。發財金的部分則以吉祥物 Pukii 及 CB 超人搭配龍年造型。至於數位帳戶方面，上海商銀表示，開戶就有 20 萬的額度可享 1.96% 優利活存，只要用數位帳戶設定信用卡代扣繳，或有 1000 以上的外幣存款，限額還能提高到等值 30 萬，過年紅包當然是存起來賺利息，讓紅包越來越大包，更方便的是，小朋友只要七歲以上領有身分證，都可以線上辦理上海商銀數位帳戶開戶。 從辦年貨到存紅包，上海商銀推出一系列的好康，還攜手南農電舖讓民眾採買年貨免出門，結帳時只要選台灣 Pay，還有好禮享不完。另外，小店家想要接受市面上眾多的行動支付，不用再申請一堆 QR Code，只要申請一個「TWQR」條碼，就可以一應俱全。「龍年賀歲，財運滾滾來」活動即日起至 2 月 23 日，只要到上海商銀全台任一分行，出示上海商銀 ATM 金額 1000 元 (含) 以上提款 / 轉帳、無卡存款、跨行存款、行動提款不限金額交易明細表、掌上銀 APP 轉帳交易結果頁、全球一路通 APP 登入系統畫面或上海商銀 LINE 好友的兌換券，皆可兌換發財金或發財水一份，數量有限，送完為止。,https://news.cnyes.com/news/id/5436605
2024/01/24,11:19,〈焦點股〉訊舟挾漲WiFi 7 元年題材逾半根停板 站上所有均線,訊舟,網通設備廠訊舟 () 今 (24) 日開高走高，股價最高來到 16.95 元，漲逾半根停板，站上所有均線，成交量超過 1.5 萬張。訊舟資深副總潘良榮曾在法說會時指出，預估今年電信部門將有相當程度的成長。 訊舟今天以 15.95 元開高走高，盤中一度觸及 16.95 元，漲幅近 7%，一舉站上所有均線，成交量也放大至 1 萬多張。觀察三大法人近日籌碼動向，三大法人已連 4 買，合計買超 1457 張。 潘良榮先前表示，看好電信部門有一定程度的成長，尤其在亞太地區將會是快速成長的區域。商用及零售產品方面，潘良榮則維持相同看法，一直都是穩定成長的趨勢，加上今年被譽為「WiFi 7 元年」，因此訊舟將商用及零售產品類別重點放在 WiFi 7 與 AIoT。 訊舟去年 12 月營收 3.01 億元，月減 8.18%，年減 43.07%。累計 2023 全年營收 42.55 億元，年減 28.31%。,https://news.cnyes.com/news/id/5436606
2024/01/24,11:11,晶睿看好雲端安防營運效率 旗下VORTEX再推新功能搶市,晶睿,安控大廠晶睿 () 看好雲端安防解決方案帶來的營運效率，旗下智慧型雲端安防服務 VORTEX 再推出新功能 VORTEX Connect，可將現有設備即刻上雲，達到隨時、隨地、跨裝置的安防需求。 VORTEX Connect 是內建於晶睿通訊最新一代網路錄影機 (NVR) 的軟體服務，可以直覺、簡易方式接上 NVR 並同時使用 VORTEX 雲服務，用戶不需汰換既有網路攝影機，現有設備即刻上雲。除了此次新功能外，晶睿未來將推出 VORTEX Connect PRO，大幅提升設備連線上限數，組織下最多分配 1000 名用戶，提供各別隱私權存取及攝影機群組分配權限，可隨時撤銷或變更現有用戶設定，提高資源分配效率及管理彈性。此外，重要事件片段可進行雲端封存及備份，降低因硬碟毀損、錄影資料空間不足發生的被刪除、改寫風險；全自動更新設備韌體，降低用戶維運時間與成本。晶睿表示，VORTEX 以高影像解析、高階 AI 分析、簡易安裝升級及遠端管理等優勢，致力中小企業加速走向安防雲端化，在北美市場打開知名度。根據 2023 年安防報告 ，全球雲端軟體為基礎的服務營收近五年年複合成長率 (CAGR) 達 22%，並預估整體全球影像監控及服務 (VSaaS)2023 年營收將增長超過 28%，顯示市場潛力。,https://news.cnyes.com/news/id/5436572
2024/01/24,11:07,〈焦點股〉和碩傳獨家接下AI Pin代工大單 激勵股價勁揚,和碩,代工大廠和碩 () 傳出獨家接下將在 3 月開賣的 AI Pin 代工大單，激勵和碩股價今 (24) 日跳空開 87.2 元，一度漲逾半根停板來到 88.1 元，但隨後賣壓出籠漲幅收斂，成交量超過 1.2 萬張。 AI Pin 以大型語言模型為基底，重量不到 100 公克，沒有螢幕，可以直接夾在胸前。使用者可以透過手勢或是語音操作 AI Pin，並以投影的方式呈現。AI Pin 體積雖小，但可使用的功能堪比一支手機，包括上網、語音通話等都可以在 AI Pin 上做到。 和碩董事長童子賢於周日 (21 日) 在和碩團圓日時提到，期望今年和碩可以「飛龍在天」，共同執行長鄭光志則指出，三大產品線中，電動車今年同樣維持雙位數成長的看法，伺服器在年中也將會有中大型 CSP 少量出貨，網通則會是比較辛苦的一年。 展望今年，共同執行長鄧國彥表示，上半年全球經濟狀況仍不明朗，加上地緣政治風險等不利因素，使得上半年變數較大，不過下半年隨著新產品的推出，尤其 AI PC 以及消費性產品，可望迎來豐碩的下半年。,https://news.cnyes.com/news/id/5436573
2024/01/24,11:06,王品再釋400個職缺 2月啟動調薪 高於市場平均15%,王品,連鎖餐飲集團王品 () 今 (24) 日宣布，由於新開店帶動人力需求，第一季共將釋出 400 個職缺，以鍋物、中餐品牌為主，將加強召募儲備店長、主廚和內外場儲備幹部，並於 2 月再次啟動加薪，平價火鍋「石二鍋」、「12MINI」調漲調升 4%，較市場平均起薪多 15%。據人力求職網最新調查顯示，高達 95% 上班族想在龍年農曆年後換工作，比例創 15 年來新高，其中近 75% 已開始找工作；而王品是「夢幻跳槽企業」傳產業第 7 名、排名較去年提升 2 名，更蟬聯餐飲人最想跳槽的企業第 1 名。農曆年前王品加速展店，1 月已連開 4 家店，包括「青花驕」新莊中原店、「陶板屋」斗六民生南店、「聚日式鍋物」大里大買家店和「石二鍋」北港家樂福店，最新中餐品牌「朝粥幫」也將開幕，因此，王品大力招募人才加入，並給出優渥待遇。王品指出，去年集團共啟動 4 波調薪計畫，過半數品牌如鐵板燒、鍋物、中餐等均調升起薪，以鐵板燒招募起薪累計調幅近 12% 最高。而 2 月王品將再次啟動加薪計畫，平價火鍋「石二鍋」、「12MINI」正職起薪含全勤雙雙調升為 34400 元起，漲幅約 4%，較市場平均起薪多 15%。王品以鍋物品牌為例，儲備幹部若通過考核，晉升為店長、主廚，有機會挑戰一年加薪 1 萬元，平均月薪上看 9 萬元。另外，王品提供月月晉升調薪機制、每年 3 月、9 月可按績效決定調薪資格和幅度，去年共 4400 人次獲加薪機會，平均累計調幅約 6.4%。王品進一步指出，門店同仁還可申請技能津貼為自己加薪，去年有店長透過多種薪資調升機制，入職半年多已成功加薪 1 萬多元，累計調幅最高達 33%。,https://news.cnyes.com/news/id/5436570
